{
  "$schema": "http://json-schema.org/draft-07/schema#",
  "$id": "https://github.com/arkade-os/solver-registry/schema/card.schema.json",
  "title": "Solver card",
  "description": "One solver's market listing for one network. Path: solvers/<network>/<name>.json",
  "type": "object",
  "additionalProperties": false,
  "required": [
    "version",
    "name"
  ],
  "dependencies": {
    "sig": [
      "discovery_pubkey"
    ]
  },
  "if": {
    "not": {
      "properties": {
        "markets": {}
      },
      "required": [
        "markets"
      ]
    }
  },
  "then": {
    "properties": {
      "discovery_pubkey": {},
      "transports": {},
      "sig": {}
    },
    "required": [
      "discovery_pubkey",
      "transports",
      "sig"
    ]
  },
  "definitions": {
    "transports": {
      "type": "object",
      "additionalProperties": false,
      "required": [
        "nostr"
      ],
      "minProperties": 1,
      "properties": {
        "nostr": {
          "type": "object",
          "required": [
            "relays"
          ],
          "properties": {
            "relays": {
              "type": "array",
              "minItems": 1,
              "maxItems": 8,
              "items": {
                "type": "string",
                "format": "uri",
                "pattern": "^wss?://",
                "description": "A Nostr relay URL the solver listens on."
              }
            }
          },
          "description": "Nostr transport config. `relays` is required; the object stays open to future nostr-specific settings."
        }
      },
      "description": "The v0 transport map. Nostr is the only supported protocol key."
    },
    "asset": {
      "type": "object",
      "additionalProperties": false,
      "required": [
        "id",
        "name",
        "ticker",
        "decimals"
      ],
      "properties": {
        "id": {
          "type": "string",
          "pattern": "^(arkade:(?:bitcoin/slip44:0|(?:signet|mutinynet|regtest)/slip44:1)|arkade:(?:bitcoin|signet|mutinynet|regtest)/asset:[0-9a-f]{68}|bolt11:(?:bitcoin/slip44:0|(?:signet|mutinynet|regtest)/slip44:1)|bolt11:(?:bitcoin|signet|mutinynet|regtest)/asset:[0-9a-f]{68}|bitcoin:(?:bitcoin/slip44:0|(?:signet|mutinynet|regtest)/slip44:1)|bitcoin:(?:bitcoin|signet|mutinynet|regtest)/asset:[0-9a-f]{68}|eip155:[1-9][0-9]{0,31}/slip44:(?:0|[1-9][0-9]{0,9})|eip155:[1-9][0-9]{0,31}/erc20:0x[0-9a-f]{40})$",
          "description": "Canonical asset identity: a CAIP-19-shaped id, \"<chain-namespace>:<chain-reference>/<asset-namespace>:<asset-reference>\". The chain namespace IS the corridor \u2014 bundled into the id rather than a separate base_corridor/quote_corridor field \u2014 so the id alone is a market side's whole leg identity: \"arkade:bitcoin/slip44:0\" (BTC on Arkade mainnet), \"bolt11:bitcoin/slip44:0\" (BTC over Lightning), \"bitcoin:bitcoin/slip44:0\" (BTC onchain), \"arkade:bitcoin/asset:<68-hex>\" (an Arkade-issued asset), \"eip155:1/slip44:60\" (ETH, the chain's own coin, on Ethereum mainnet), \"eip155:1/erc20:0x\u2026\" (an ERC-20 on Ethereum mainnet). For arkade/bolt11/bitcoin the chain-reference is the Arkade network the side settles on (bitcoin, signet, mutinynet, regtest \u2014 the same vocabulary as the card's own path), and the slip44 reference it pairs with is fixed by that network, not open: 0 (Bitcoin) on 'bitcoin' (mainnet), 1 (Testnet, all coins) everywhere else \u2014 'arkade:bitcoin/slip44:1' and 'arkade:mutinynet/slip44:0' are both malformed. For eip155 the chain-reference is the numeric EIP-155 chain id, and any chain id is well-formed \u2014 adding an EVM chain needs no schema edit, unlike the old per-chain corridor enum \u2014 with slip44 staying open there too, since it names whatever coin type that chain's own coin has. Lowercase throughout, not EIP-55 mixed case, so the identity is byte-comparable; the checksum belongs to display, not to a grouping key. The asset-namespace half also tells a taker WHICH SETTLEMENT path a corridor uses: \"slip44\" is a plain value transfer of a chain's native coin, \"erc20\" settles through that token's contract, \"asset\" is an Arkade-issued asset. An erc20 reference is the TOKEN's contract address, never a swap contract's \u2014 a taker resolves the latter from the corridor, not from this field."
        },
        "name": {
          "type": "string",
          "minLength": 1,
          "maxLength": 64
        },
        "ticker": {
          "type": "string",
          "minLength": 1,
          "maxLength": 16
        },
        "decimals": {
          "type": "integer",
          "minimum": 0,
          "maximum": 18,
          "description": "Decimals of the atomic unit: atomic units per display unit = 10^decimals. Matches the asset registry metadata field."
        }
      }
    },
    "legacyAsset": {
      "type": "object",
      "additionalProperties": false,
      "required": [
        "id",
        "name",
        "ticker",
        "decimals"
      ],
      "properties": {
        "id": {
          "type": "string",
          "pattern": "^(btc|[0-9a-f]{68})$",
          "description": "Legacy v0 asset identity retained so already-signed cards remain valid during the compatibility window."
        },
        "name": {
          "type": "string",
          "minLength": 1,
          "maxLength": 64
        },
        "ticker": {
          "type": "string",
          "minLength": 1,
          "maxLength": 16
        },
        "decimals": {
          "type": "integer",
          "minimum": 0,
          "maximum": 18
        }
      }
    },
    "priceFeedSchema": {
      "type": "object",
      "additionalProperties": false,
      "required": [
        "type",
        "price_path"
      ],
      "properties": {
        "type": {
          "const": "json",
          "description": "The price feed response is JSON."
        },
        "price_path": {
          "type": "string",
          "pattern": "^(?:/(?:[^~/]|~0|~1)*)*$",
          "description": "RFC 6901 JSON Pointer to the numeric feed value, e.g. /price or /bitcoin/usd. Empty string selects the whole JSON document."
        }
      }
    },
    "amount": {
      "type": "string",
      "pattern": "^(0|[1-9][0-9]{0,29})$",
      "description": "A canonical decimal-string amount of atomic units: unsigned, no leading zeros. \"0\" disables the side it bounds."
    },
    "enabledAmount": {
      "type": "string",
      "pattern": "^[1-9][0-9]{0,29}$",
      "description": "An amount that is strictly positive: the side it bounds is enabled."
    },
    "solverFeeSide": {
      "type": "object",
      "additionalProperties": false,
      "properties": {
        "bps": {
          "type": "integer",
          "minimum": 0,
          "maximum": 10000,
          "description": "This direction's spread. OPTIONAL; absent falls back to the market's fee_bps. fee_bps MUST equal the widest spread declared here, because a reader predating solver_fee applies it to both directions — understating one would have that reader compute a payout the solver refuses, after the offer is funded on chain."
        },
        "flat": {
          "allOf": [
            {
              "$ref": "#/definitions/amount"
            }
          ],
          "description": "The part of the price that does not scale with size, in atomic units of the side this sits under. Needs no denominator of its own: the enclosing key already names it, and the solver charges it in the deposit's own units, so nothing is converted through the price. OPTIONAL; absent means none."
        }
      },
      "description": "One direction's whole fee, selected by the side the maker DEPOSITS. Both terms are additive: the flat part comes off the deposit, then the spread applies to what is left."
    }
  },
  "properties": {
    "version": {
      "enum": [
        0,
        1
      ],
      "description": "Card format version. 0 is every card written before EVM corridors existed. A card MUST declare 1 when any market side's asset id names a corridor introduced after 0 (today: eip155, i.e. any EVM chain); a consumer that understands only 0 MUST reject a version-1 card outright rather than interpret the markets it recognises and skip the rest. Bumping is about INTERPRETATION, not encoding: the canonical form and signature are unchanged, so a v0 verifier would still compute a matching digest \u2014 and would then be trusting a rail it cannot settle on."
    },
    "name": {
      "type": "string",
      "pattern": "^[a-z0-9-]+$",
      "description": "Unique within the network directory; must equal the filename (without .json)."
    },
    "discovery_pubkey": {
      "type": "string",
      "pattern": "^[0-9a-f]{64}$",
      "description": "BIP340 x-only public key, lowercase hex."
    },
    "sig": {
      "type": "string",
      "pattern": "^[0-9a-f]{128}$",
      "description": "BIP340 Schnorr signature by discovery_pubkey over sha256(canonical_json)."
    },
    "transports": {
      "allOf": [
        {
          "$ref": "#/definitions/transports"
        }
      ],
      "description": "Nostr relay URLs the solver listens on. Required \u2014 with discovery_pubkey and sig \u2014 when any market has a non-arkade corridor (the reducer enforces this cross-field rule): they are the rendezvous makers address request-for-quote messages to."
    },
    "markets": {
      "type": "array",
      "minItems": 1,
      "description": "Absent makes the card a pointer: the solver's markets come signed over its transports, and discovery_pubkey, transports and sig are then required.",
      "items": {
        "type": "object",
        "additionalProperties": false,
        "required": [
          "base_asset",
          "quote_asset",
          "fee_bps",
          "min_base_amount",
          "max_base_amount",
          "min_quote_amount",
          "max_quote_amount"
        ],
        "anyOf": [
          {
            "properties": {
              "max_base_amount": {
                "$ref": "#/definitions/enabledAmount"
              }
            }
          },
          {
            "properties": {
              "max_quote_amount": {
                "$ref": "#/definitions/enabledAmount"
              }
            }
          }
        ],
        "oneOf": [
          {
            "description": "Canonical CAIP-19 market shape.",
            "not": {
              "anyOf": [
                { "properties": { "pair": {} }, "required": ["pair"] },
                { "properties": { "base_corridor": {} }, "required": ["base_corridor"] },
                { "properties": { "quote_corridor": {} }, "required": ["quote_corridor"] }
              ]
            },
            "properties": {
              "base_asset": { "$ref": "#/definitions/asset" },
              "quote_asset": { "$ref": "#/definitions/asset" }
            }
          },
          {
            "description": "Legacy v0 market shape retained for already-signed cards during the compatibility window.",
            "required": ["pair"],
            "properties": {
              "pair": {
                "type": "string",
                "pattern": "^((lightning|onchain):)?[A-Za-z0-9._-]{1,16}/((lightning|onchain):)?[A-Za-z0-9._-]{1,16}$"
              },
              "base_asset": { "$ref": "#/definitions/legacyAsset" },
              "quote_asset": { "$ref": "#/definitions/legacyAsset" },
              "base_corridor": { "enum": ["arkade", "lightning", "onchain"] },
              "quote_corridor": { "enum": ["arkade", "lightning", "onchain"] }
            }
          }
        ],
        "properties": {
          "pair": {
            "type": "string",
            "description": "Legacy v0 display pair. Canonical markets omit this field."
          },
          "base_asset": {
            "description": "The pair's base side. Its `id` carries the corridor (chain namespace) as well as the asset \u2014 see `#/definitions/asset`. When exactly one side's id names the arkade corridor it must be this side (the reducer enforces this), so equivalent corridor markets group under one canonical key."
          },
          "quote_asset": {
            "description": "The pair's quote side. Its `id` carries the corridor (chain namespace) as well as the asset \u2014 see `#/definitions/asset`."
          },
          "base_corridor": {
            "type": "string",
            "description": "Legacy v0 base corridor. Canonical markets omit this field."
          },
          "quote_corridor": {
            "type": "string",
            "description": "Legacy v0 quote corridor. Canonical markets omit this field."
          },
          "price_feed": {
            "type": "string",
            "format": "uri",
            "pattern": "^https?://",
            "description": "Required when the sides carry different assets; must be absent (with the other feed fields) on a same-asset market, whose price is identically 1 \u2014 fee_bps and fee_flat are the whole price and executable terms arrive in the solver's RFQ quote. The reducer enforces this cross-field rule."
          },
          "price_feed_schema": {
            "$ref": "#/definitions/priceFeedSchema"
          },
          "price_decimals": {
            "type": "integer",
            "minimum": 0,
            "maximum": 18,
            "description": "The feed value divided by 10^price_decimals is the price in quote-atomic-units per base-atomic-unit."
          },
          "fee_bps": {
            "type": "integer",
            "minimum": 0,
            "maximum": 10000
          },
          "fee_flat": {
            "allOf": [
              {
                "$ref": "#/definitions/amount"
              }
            ],
            "description": "The part of the price that does not scale with size, in quote-asset atomic units. OPTIONAL; absent means none. Quote-asset in both directions, matching min_quote_amount/max_quote_amount, so a client converts it through the price when the maker receives base. Note that fee_bps alone is therefore not a ranking key: a market with a lower spread and a flat fee can be dearer at small sizes and cheaper at large ones."
          },
          "solver_fee": {
            "type": "object",
            "additionalProperties": false,
            "properties": {
              "base": {
                "$ref": "#/definitions/solverFeeSide",
                "description": "Applies when the maker DEPOSITS the base asset, i.e. sells base."
              },
              "quote": {
                "$ref": "#/definitions/solverFeeSide",
                "description": "Applies when the maker DEPOSITS the quote asset, i.e. buys base."
              }
            },
            "description": "The solver's whole fee, keyed by the side the maker DEPOSITS. Exactly one key applies per swap, so the two are alternatives and never a sum. That key also fixes the units for everything under it, which is why `flat` needs no denominator of its own and why the spread may differ by direction. SUPERSEDES fee_flat where present and is never summed with it, so a card mid-migration may carry both and a reader predating this field still prices from fee_flat. OPTIONAL; absent means fee_bps/fee_flat alone."
          },
          "charges_delivered_carrier": {
            "type": "boolean",
            "description": "Whether this solver charges the maker for the dust carrier it delivers when the maker RECEIVES an Arkade asset. A pricing input, not a fee: a client computing terms from this card must net it out of the deposit exactly as the solver does, or the offer it funds is refused. OPTIONAL; absent means it does not charge. The AMOUNT is deliberately not published — it is the Arkade Service's dust, and both parties to an Arkade-settled swap share that Service, so a client reads the live figure there rather than from a card that can be cached. Only the policy is unknowable elsewhere. Meaningless when neither side is an Arkade asset, since there is no carrier to deliver."
          },
          "min_base_amount": {
            "allOf": [
              {
                "$ref": "#/definitions/amount"
              }
            ],
            "description": "Lower trade-size bound for the base side, in base atomic units. An enabled side has 1 <= min <= max; when the side is disabled (max = \"0\") min MUST be \"0\"."
          },
          "max_base_amount": {
            "allOf": [
              {
                "$ref": "#/definitions/amount"
              }
            ],
            "description": "Upper trade-size bound for the base side, in base atomic units. \"0\" disables the side: the solver does not pay out base and makers cannot receive it."
          },
          "min_quote_amount": {
            "allOf": [
              {
                "$ref": "#/definitions/amount"
              }
            ],
            "description": "Lower trade-size bound for the quote side, in quote atomic units. An enabled side has 1 <= min <= max; when the side is disabled (max = \"0\") min MUST be \"0\"."
          },
          "max_quote_amount": {
            "allOf": [
              {
                "$ref": "#/definitions/amount"
              }
            ],
            "description": "Upper trade-size bound for the quote side, in quote atomic units. \"0\" disables the side: the solver does not pay out quote and makers cannot receive it."
          }
        }
      }
    }
  }
}
