{
  "version": 0,
  "name": "corridor-solver",
  "discovery_pubkey": "dff1d77f2a671c5f36183726db2341be58feae1da2deced843240f7b502ba659",
  "transports": {
    "nostr": {
      "relays": [
        "wss://relay.example.com"
      ]
    }
  },
  "markets": [
    {
      "base_asset": {
        "id": "arkade:bitcoin/slip44:0",
        "name": "Bitcoin",
        "ticker": "BTC",
        "decimals": 8
      },
      "quote_asset": {
        "id": "bolt11:bitcoin/slip44:0",
        "name": "Bitcoin",
        "ticker": "BTC",
        "decimals": 8
      },
      "fee_bps": 20,
      "min_base_amount": "1000",
      "max_base_amount": "4000000",
      "min_quote_amount": "1000",
      "max_quote_amount": "4000000"
    }
  ],
  "sig": "99479b6cc8117d6ea3aa00eade3a842110c9e2d25280dbabdb12856f87477604487b16225ef72049b4be2da04e1607a65a0ed5335f04cdf24c46f6d0243f1651"
}
