{
  "version": 0,
  "name": "signed-solver",
  "discovery_pubkey": "dff1d77f2a671c5f36183726db2341be58feae1da2deced843240f7b502ba659",
  "transports": {
    "nostr": {
      "relays": [
        "wss://relay.example.com",
        "wss://relay2.example.com"
      ]
    }
  },
  "markets": [
    {
      "base_asset": {
        "id": "arkade:signet/slip44:1",
        "name": "Bitcoin",
        "ticker": "BTC",
        "decimals": 8
      },
      "quote_asset": {
        "id": "bolt11:signet/slip44:1",
        "name": "Bitcoin",
        "ticker": "BTC",
        "decimals": 8
      },
      "fee_bps": 25,
      "min_base_amount": "1000",
      "max_base_amount": "5000000",
      "min_quote_amount": "1000",
      "max_quote_amount": "5000000"
    },
    {
      "base_asset": {
        "id": "arkade:signet/slip44:1",
        "name": "Bitcoin",
        "ticker": "BTC",
        "decimals": 8
      },
      "quote_asset": {
        "id": "bitcoin:signet/slip44:1",
        "name": "Bitcoin",
        "ticker": "BTC",
        "decimals": 8
      },
      "fee_bps": 40,
      "min_base_amount": "0",
      "max_base_amount": "0",
      "min_quote_amount": "20000",
      "max_quote_amount": "1000000"
    },
    {
      "base_asset": {
        "id": "bolt11:signet/slip44:1",
        "name": "Bitcoin",
        "ticker": "BTC",
        "decimals": 8
      },
      "quote_asset": {
        "id": "bitcoin:signet/slip44:1",
        "name": "Bitcoin",
        "ticker": "BTC",
        "decimals": 8
      },
      "fee_bps": 40,
      "min_base_amount": "0",
      "max_base_amount": "0",
      "min_quote_amount": "1000",
      "max_quote_amount": "2000000"
    }
  ],
  "sig": "d982e51ec30818e033e234c7b27591785b64074eb4121e11310fdbb6a77fd60673e5c78a3c1180d89aad365f315c9f6e38610e79b1c3440e2a66956fcd9f2114"
}
