{
  "version": 0,
  "name": "ln-solver-mutinynet",
  "discovery_pubkey": "3f831510a6d7678d0c90d7d6fbc4057720517e2e30681ef4c87cc57aaf57e8d5",
  "transports": {
    "nostr": {
      "relays": [
        "wss://nostr.arkade.sh"
      ]
    }
  },
  "markets": [
    {
      "pair": "BTC/lightning:BTC",
      "base_asset": {
        "id": "btc",
        "name": "Bitcoin",
        "ticker": "BTC",
        "decimals": 8
      },
      "quote_asset": {
        "id": "btc",
        "name": "Bitcoin",
        "ticker": "BTC",
        "decimals": 8
      },
      "quote_corridor": "lightning",
      "fee_bps": 30,
      "min_base_amount": "1000",
      "max_base_amount": "50000",
      "min_quote_amount": "1000",
      "max_quote_amount": "25000"
    },
    {
      "pair": "BTC/onchain:BTC",
      "base_asset": {
        "id": "btc",
        "name": "Bitcoin",
        "ticker": "BTC",
        "decimals": 8
      },
      "quote_asset": {
        "id": "btc",
        "name": "Bitcoin",
        "ticker": "BTC",
        "decimals": 8
      },
      "quote_corridor": "onchain",
      "fee_bps": 0,
      "min_base_amount": "1000",
      "max_base_amount": "50000",
      "min_quote_amount": "1000",
      "max_quote_amount": "50000"
    }
  ],
  "sig": "9eb76dddd0c793a0d0a7bf1a78ea63e41a8e751df006721c116be0898b4189d2a9ea4b4fb23ddd8c0c88cf5c425f6ca96fab4d6dc1f8c5986cca143ccee8404a"
}
